Responder #,Vote,Explanation,Age Range,Gender Identity,Kids Toy Buying Frequency,Hobbies And Interests,Age Of Kids,Parents
1,B-C-D-A-E,i would prefer to just read to my kids or have them read to each other but my next choice would be a device with audio only,25-34,Female,Frequently,Crochet / knitting; Cooking; Health and fitness; Travel; Reading; Boating; Arts and crafts,6-11 years old; 4-5 years old; 0-3 years old,Yes
2,A-D-C-E-B,"I think a single purpose device is very important, I don't want my kids to have any tablets. I'm okay with them having images on the screen as long as it's always related to the story and there are no ads",25-34,Male,Frequently,Photography / videography; Reading; Technology; Hiking; Camping,0-3 years old; 4-5 years old,Yes
3,D-B-A-C-E,"Generally, I think I would prefer the audio only. It creates better opportunities for the child to use their imagination. I don’t want them on a phone or tablet so a single used device would be preferred.",35-44,Male,Sometimes,Camping; Boating; Board/tabletop games; Card collecting; Hiking; Arts and crafts; Health and fitness; Cooking; Reading; Gardening; Interior decorating / renovating,6-11 years old; 12-17 years old; 4-5 years old,Yes
4,B-E-A-C-D,"I have been working a lot in AI . I don't think AI should be introduced to kids just yet since we're still trying to figure a lot of it out , then I'm gonna go with B . Nothing . I would rather not use any AI enabled devices or app for storytelling for my children at this point . ",35-44,Male,Frequently,"Health and fitness; Other; Visiting art galleries, museums, exhibitions; Travel; Reading; Playing music; Photography / videography; Hiking",6-11 years old; 4-5 years old; 0-3 years old,Yes
5,C-E-A-D-B,I chose option C first because I think an app would provide the most reach to customers.,35-44,Male,Frequently,"Reading; Board/tabletop games; Technology; Cooking; Playing music; Health and fitness; Other; Visiting art galleries, museums, exhibitions; Travel",6-11 years old; 4-5 years old,Yes
6,A-D-C-E-B,I think this is  a nice way to get them off of their tablets and tvs and help with their imagination. Would also be a great way for parents to catch a breather,35-44,Female,Frequently,Board/tabletop games; Card collecting; Camping; Boating; Arts and crafts; Cooking; Technology; Reading; Playing music; Gardening,12-17 years old; 6-11 years old; 4-5 years old,Yes
7,D-A-C-B-E,"I would be fine with either options D or A. I like that this is an audio only device and I would not have to use a smartphone. This sounds like a very uncomplicated device that would be simple to use and to learn to use. I like the simplicity of the device, that means it would be easy to teach a child how to use it. The simplicity of it is the reason I would buy it   ",25-34,Female,Frequently,Boating; Board/tabletop games; Arts and crafts; Health and fitness; Cooking; Camping; Crochet / knitting; Playing music; Watching sports on TV; Technology; Reading,4-5 years old; 6-11 years old; 0-3 years old,Yes
8,A-E-D-C-B,"I prefer option Dedicated single-purpose device(Audio + Images) AI-enabled story-telling device most. It is unlike tablets or phone, it's not cluttered with apps or notifications. Keeps children immersed in storytelling without temptation to browse the internet or watch unrelated videos. My second choice is option E, third choice is option D.",35-44,Male,Frequently,"Visiting art galleries, museums, exhibitions; Photography / videography; Travel; Reading",12-17 years old; 4-5 years old; 6-11 years old,Yes
9,E-C-A-D-B,I choose E first because I can download it on my daughter's tablet and she can play with it and ask for stories she loves them,35-44,Female,Frequently,Hunting / fishing; Reading; Camping; Boating,4-5 years old; 12-17 years old,Yes
10,B-C-E-A-D,I don’t really understand AI and its general concept makes me uncomfortable/ has a negative stigma. I am not complete Opposed to using it with some education.,35-44,Female,Frequently,Cooking; Playing music; Gardening; Reading,6-11 years old; 4-5 years old,Yes
11,A-C-D-E-B,I prefer dedicated device with both image and audio which keeps children engaged and also distraction free. Audio only will be not that engaging.,25-34,Female,Sometimes,Boating; Watching sports on TV; Gardening; Camping; Health and fitness; Reading; Arts and crafts; Playing music; Travel; Photography / videography,6-11 years old; 4-5 years old,Yes
12,B-D-A-C-E,"I'd go with detailed device with audio + visual because it offers the right mix of child independence, learning value, and peace of mind for me as a parent. I want my kids to be creative, but I also want the protected from distractions, and a device that's fun, engaging and safe check all those boxes.",25-34,Male,Frequently,Technology; Gardening; Reading; Watching sports on TV,4-5 years old; 6-11 years old,Yes
13,A-E-C-D-B,I think an AI tool for kids that can use their imagination and create any story they want is amazing 😍 I would choose option A because it's an app that can be used for the phone and that's convenient.,45-54,Female,Sometimes,Reading,4-5 years old,Yes
14,D-E-C-B-A,"I chose D first, because I like my devices or products to be simple to use and not too complex.",55-64,Male,Sometimes,Hiking; Watching sports on TV; Other; Reading,4-5 years old,Yes
15,C-B-D-E-A, Unsure about A.I. at this time. Not sure AI is the best way to do anything as it takes a lot of personal information to use AI ,35-44,Female,Frequently,Playing music; Arts and crafts; Travel; Reading,0-3 years old; 4-5 years old,Yes
16,D-B-E-A-C,"I would entertain a single use device, so I know they aren't dealing with other things on the phone or tablet as well. I would also advise against any images, I would just want it to be a story telling device. I would have a lot of questions for how it would generate stories and what it could and couldn't do. ",35-44,Male,Frequently,Gardening; Travel; Technology; Reading; Playing music; Hiking; Health and fitness; Cooking; Camping,4-5 years old; 6-11 years old,Yes
17,E-C-B-D-A,Truthfully we all have phones at this point and it’s just easier to have an app on your phone. I’d rather do that or no AI at all versus having to pay an extra $500-1000 for a whole other piece of tech that literally only does one thing in the hands of a child. ,35-44,Male,Sometimes,"Visiting art galleries, museums, exhibitions; Travel; Other; Reading",6-11 years old; 4-5 years old,Yes
18,B-A-E-C-D,"Storytime should be a special time between parents and children. When parents aren't involved and being replaced by a device, it's detrimental to the child and society as a whole. I can remember telling my son bedtime stories, making them up on the fly. That is a wonderful tradition I would hate to see be replaced by a machine.",35-44,Male,Sometimes,Card collecting; Board/tabletop games; Camping; Boating; Arts and crafts; Hiking; Gardening; Other; Reading; Playing music; Cooking,4-5 years old,Yes
19,A-D-B-C-E,I like option A because it is creative. I would feel comfortable purchasing this item for my children because I would not have to monitor them as closely as I do when they are using apps or websites. Also with this product I would not have to worry about privacy or my children making unauthorized purchases. I also like that it gives audio and visual information about the story. I would definitely purchase this product for my children. ,45-54,Female,Frequently,Health and fitness; Interior decorating / renovating; Travel; Arts and crafts; Cooking; Reading; Crochet / knitting,4-5 years old; 6-11 years old,Yes
20,B-D-A-E-C,I don't trust AI. I have many security concerns.  I don't like apps listening in constantly and knowing all of my information on my phone or tablet.,35-44,Male,Sometimes,Watching sports on TV; Board/tabletop games; Reading; Hiking,4-5 years old; 6-11 years old,Yes
21,E-A-D-B-C,I wouldn’t buy this for my child because he has autism and things like this don’t appeal to him. ,35-44,Female,Frequently,Interior decorating / renovating; Board/tabletop games; Photography / videography; Reading,12-17 years old; 4-5 years old,Yes
22,B-C-D-A-E,I wouldn't want AI to be in charge of telling my kids stories,35-44,Female,Sometimes,Technology; Reading; Playing music; Gardening,0-3 years old; 4-5 years old,Yes
23,C-E-D-A-B,"i would be interested in this option because it offers a balance of affordability, convenience and creative engagement for children.it is better",35-44,Male,Sometimes,Gardening; Watching sports on TV; Reading; Board/tabletop games,6-11 years old; 4-5 years old; 12-17 years old,Yes
24,D-C-E-A-B,"I like the one that doesn't have any apps, just a single button especially for autistic children. sometimes too many buttons can make them overwhelmed so I like this option",25-34,Female,Frequently,"Visiting art galleries, museums, exhibitions; Technology; Reading",4-5 years old; 0-3 years old,Yes
25,A-D-C-E-B,A and D sound the most appealing to me,35-44,Male,Frequently,Board/tabletop games; Card collecting; Camping; Boating; Playing music; Cooking; Technology; Hiking; Reading; Arts and crafts; Health and fitness,0-3 years old; 6-11 years old; 4-5 years old,Yes
26,A-C-D-E-B,"Supporting both audio and images is the first choice. Option A, without any other applications that could interfere, makes me feel more at ease letting my child use it.",25-34,Female,Frequently,Reading; Travel; Card collecting,4-5 years old,Yes
27,C-D-E-A-B,I would buy the product of option C. This one is better than the other three. Being able to interact while the child listens to the story and also see the illustrations is enough to satisfy me. I would buy this for my child. This product can help cultivate my childs interest in reading.,18-24,Female,Frequently,"Reading; Visiting art galleries, museums, exhibitions; Interior decorating / renovating; Photography / videography",4-5 years old,Yes
28,A-D-E-C-B,"My first choice is A because its the most professional device, with both video and audio that allows interaction, and it doesn't require extra supervision. Options D and E lack video features, and C adds a burden on parents since it needs an extra phone. I'm not considering B because it requires additional tools to help my child with reading training.",18-24,Male,Frequently,"Health and fitness; Watching sports on TV; Visiting art galleries, museums, exhibitions; Reading",4-5 years old,Yes
29,A-C-E-D-B,I put Project A in the first place because it fits my child's interests very well and can help my child want to learn better.,55-64,Male,Frequently,Travel; Reading; Cooking,4-5 years old,Yes
30,C-E-D-A-B,"I will choose mobile or tablet applications, which will be more convenient and won't require any additional purchases.",45-54,Female,Frequently,Reading; Photography / videography; Playing music,4-5 years old,Yes
31,D-A-C-E-B,"The reason this product ranks first is that it meets children's needs, is affordable, and is easy to operate.",35-44,Male,Frequently,Technology; Reading,4-5 years old,Yes
32,C-A-E-D-B,"I will buy option C of this product for my child, as it can be easily used by them, which makes me feel more at ease.",55-64,Male,Frequently,Travel; Reading; Hunting / fishing; Photography / videography,4-5 years old,Yes
33,C-E-A-D-B,"My favorite is C because its delivered through a mobile app with comprehensive features, making it very convenient without needing to buy extra equipment. E has fewer features, while A and D require additional devices to meet the needs, which is costly and troublesome. I'm not considering B.",35-44,Female,Frequently,Reading; Gardening; RVing / motor caravanning; Crochet / knitting,4-5 years old,Yes
34,C-D-E-A-B,"I am very satisfied with product C; it allows my child to engage in conversation intelligently, and the smart device can also spark more interest in learning for them.",45-54,Female,Frequently,Hunting / fishing; Crochet / knitting; Reading; Camping,4-5 years old,Yes
35,A-C-B-D-E,"I would choose product A; its functions are very straightforward, and it includes the ability to converse with children, which makes it a great product for helping kids tell stories.",55-64,Male,Frequently,RVing / motor caravanning; Reading; Arts and crafts; Crochet / knitting,4-5 years old,Yes
36,E-C-D-B-A,"I put option E in the first place because it is compatible with tablets and very convenient to use, while I placed option B last because it does not include AI.",45-54,Female,Frequently,Reading,4-5 years old,Yes
37,D-E-C-B-A,"I ranked option D first because it is very portable and convenient for kids to use, while I placed option B in last place because it has too few features.",35-44,Male,Frequently,Reading,4-5 years old,Yes
38,C-D-E-A-B,"C allows for interaction with children, which feels very fun and can effectively improve focus. D's equipment is relatively simple, which can save money well.",25-34,Female,Frequently,Reading; Cooking; Arts and crafts,4-5 years old,Yes
39,C-E-A-D-B,"I would first choose option C because it describes many benefits suitable for children to use independently, has comprehensive features, and is also reasonably priced.",25-34,Female,Sometimes,Cooking; Watching sports on TV; Reading,4-5 years old,Yes
40,C-E-A-D-B,"Using a phone or tablet is quite convenient, and the applications are relatively easy to use; standalone devices are not very practical. Stories with visuals are more likely to capture children's interest.",25-34,Male,Sometimes,Reading; Travel; Camping; Photography / videography,4-5 years old,Yes
41,E-C-A-D-B,"Options E and C are my favorite storytelling devices because smartphones and tablets are common in everyday life and are very convenient to use. Only after that would I consider options D and C, which are specialized storytelling devices. If the budget allows, I would consider purchasing them. Lastly, option B is a bit monotonous for storytelling without any devices.",25-34,Female,Frequently,Reading; Arts and crafts,4-5 years old,Yes
42,A-C-E-D-B,"I will choose to buy Product A. Because compared to other products, it's very easy to use, with only one button to operate, so it's not complicated, and it offers both image and audio features.",55-64,Female,Frequently,Technology; Reading; Gardening; Playing music,12-17 years old; 4-5 years old,Yes
43,A-C-E-D-B,"I put Plan A first in this order because it includes images and audio, which can help my children focus better.",35-44,Male,Frequently,Playing music; Reading; Interior decorating / renovating; Camping,4-5 years old,Yes
44,D-E-B-A-C,"I choose option D; this device has a full range of functions, and it's simple and convenient. The price is quite affordable, and I'm very satisfied.",45-54,Female,Sometimes,Reading; Travel; Crochet / knitting,4-5 years old,Yes
45,D-A-C-E-B,Choosing no other application development is the priority option because I'm concerned that including other apps will lead my child to play with them. I chose D because it is simpler and easier for my child to use.,35-44,Male,Frequently,Reading,0-3 years old; 4-5 years old,Yes
46,A-E-D-C-B,I ranked my choices this way because the 1st one I selected sounds the coolest! It seems simple enough for the kids to be able to turn them on and off.,35-44,Female,Frequently,Playing music; Travel; Reading; Cooking,0-3 years old; 4-5 years old,Yes
47,A-C-E-D-B,"My first choice is A, as it is more professional and has great interactivity. C is my second choice; without visuals, it feels like it would lack focus. Then there's E, which doesn't have good audio advantages and lacks interactivity. D's equipment is very inconvenient and lacks a sense of participation, while B's equipment is incomplete.",55-64,Male,Frequently,Reading; Travel,4-5 years old,Yes
48,E-D-A-C-B,"I would choose Plan E because this plan can cultivate children's communication skills, and children can interrupt the story anytime without needing their parents to supervise.",35-44,Female,Sometimes,Reading; Travel; Photography / videography,6-11 years old; 12-17 years old; 4-5 years old,Yes
49,C-A-E-D-B,"I would choose option C for purchase, as it effectively utilizes the available resources and reduces property damage. Second is A, which is more convenient but lacks focus. E feels better to use and is great for storytelling. D's equipment is a bit expensive and lacks visuals, while B would lack certain knowledge.",35-44,Male,Frequently,Interior decorating / renovating; Reading; Camping,6-11 years old; 4-5 years old,Yes
50,A-C-B-D-E,"My first choice is a dedicated single-use device, as it allows the kids to only listen to stories without being distracted by anything else.",45-54,Female,Frequently,Hiking; Health and fitness; Reading,4-5 years old,Yes
